,country_eng_nm,country_iso_alp2,country_nm,field,koreanwave_cn,written_year
308,Argentina,AR,아르헨티나,K-뷰티,"아르헨티나 한류 팬들 사이에서 ‘K-뷰티’ 열풍이 드세다. 한국식 화장법  패션 코디부터 한국인들의 라이프스타일까지 ‘K-스타일’의 모든 것을 원한다. 아르헨티나 주요 언론들도 한국식 뷰티에 주목하며 비중 있는 기사를 내놓고 있다. 짤막한 박스기사 정도가 아니다. 일간지 4면 전체에 보도되는가하면  한국이 전통적인 패션 강국 프랑스를 넘어섰다고 선언하는 기사도 자주 접할 수 있다.
대중적인 여성지 ‘빠라 띠(Para ti)’는 2017년 4월 기사에서 “프랑스가 뷰티의 요람이라면  한국은 뷰티의 미래다. 페이셜 크림부터 향수  수많은 화장품들까지  한국의 행보가 돋보인다. 지난 10년간 BB크림을 시작으로 K-뷰티가 본격적인 유명세를 얻기 시작했으며  뷰티 세계를 혁신하고 있다.”라고 보도하기도 하였다.
유력 패션 주간지 루즈(LUZ)는 2017년 1월 셋째 주 발간 호를 통해 ‘아시아적 독창성’이라는 특집기사를 게재  K-패션과 이상봉 디자이너와의 인터뷰에 대해 4면 전체를 할애하며 집중 소개하였다. 루즈 지는 이상봉 디자이너와의 인터뷰를 인용하며 “한국인들은 특출한 패셔니스타”라고 밝히며 “과거 한국이 유럽옷을 제작하기 위한 기지였다면  오늘날은 반대로 서양 패션 관계자들에게 매우중요한 시장으로 성장해 실로 세계 패션 시장의 기지로 안착했다”고 보도하기도 했다.
주간지 페르필(Perfil)은 2017년 8월 ‘한국 뷰티 붐’ 제하 기사를 통해 “한국의 뷰티산업은 매우 중요한 부분이여서  결국에는 그 국가의 국경을 넘어 결국 아르헨티나에까지 도달했다. 지역에서 제조된 양질의 뷰티 제품과 적극적인 이미지 홍보의 결과  서울은 동양 뷰티･유행의 수도로 탈바꿈하였다.”라고 보도했다.
K-뷰티에 대한 현지의 수요에 발맞춰 주아르헨티나 한국문화원은 관련 강연을 확대하고 있다. 2017년 2월에는 ‘K-뷰티의 모든 것’을 주제로 약 50여 명의 청중들을 대상으로 라틴아메리카 지역 파워 뷰티 유투버(Youtuber)가 세계적으로 각광받고 있는 한국의 뷰티산업 현황을 시작으로 BB크림･CC크림･쿠션 파운데이션 등 다양한 뷰티 제품과 함께 올해 유행할 K-뷰티 트렌드를 소개한 바 있다. K-뷰티의 비결이 하나씩 소개될 때마다  유명 패션잡지 소속 기자  현지 인기 뷰티 블로거  메이크업 전공생 등 모두가 큰 관심을 나타냈다. 동 강연에 참석한 현지 전문 메이크업 아티스트 파올라 멘도사(Paola Menoza)는 “아르헨티나에서는 유럽의 메이크업 유행을 많이 따라가는 편이다. 하지만 요즘 한류가 확장되면서 K-드라마나 영화에 나오는 한국인들의 화장법에 호기심을 갖는 고객들도 많아지고 있다. 한국에서 화장품을 잔뜩 사와서  이곳에서 보따리 장사를 하는 일부 한류 팬들도 있다고 들었다. K-뷰티에 대한 관심이 많아지는 만큼 산업적인 교류도 활발해졌으면 한다.”라고 전했다.
2017년 7월에는 ‘한국의 유행: 아방가르드와 천년의 문화’를 주제로 ‘K-스타일 전도사’로 맹활약 중인 아르헨티나 유력 주간지 페르필(Perfil) 소속 기자 파트리시아 다니엘레(Patricia Daniele)가 50여 명의 청중을 대상으로 강연을 진행했다. 강연 당일에는 라디오 채널 ‘Urbana BA Radio’의 프로그램인 ‘패션링킹(Fashion Linking)’에서도 취재를 나와 관련 특집을 마련하는 등  현지 내 K-스타일에 대한 뜨거운 관심을 여실히 보여주기도 했다.",2019.0
309,Argentina,AR,아르헨티나,디지털 문화콘텐츠,"온라인 게임 유저들 사이에서 한국 게임은 상당한 인지도가 있다. <검은사막>  <블레이드&소울>  <리니지>와 같은 게임이 큰 인기를 끌었다. 하지만 <블레이드&소울>의 경우 스페인어 번역이 제공되지 않아  크게 대중화되지 못했으며  이에 현지 팬들이 공식 버전은 아니지만 스페인어 번역판을 직접 만들어 이용하기도 했다. <검은사막>의 경우 초기에는 영어판  향후 스페인어 판이 개시되었으며 <리니지>의 경우에는 영어 번역판이 제공되어 보다 많은 게임 이용자들이 즐길 수 있었다. 아르헨티나의 인터넷 환경이 열악함에도 불구하고 한국온라인 게임에 대한 수요가 어느 정도 존재하고 있으며  스페인어 번역이 이뤄진다면 더욱 대중화될 것으로 보인다.
한류 팬들은 웹에서 무료로 이용이 가능한 K-Magazine  Korea 잡지 등 웹매거진을 활용해 한국 문화와 한류에 대한 정보를 얻고 있다. 또한 최근 대형 포털에서 외국인을 위한 웹툰 서비스가 확대되고  접근성이 높아짐에 따라 한국웹툰에 대한 인지도와 수요가 상승하고 있다. 한국 만화의 인기가 더욱 증가함에 따라 추후 웹툰의 스페인어 서비스도 제공될 예정으로 보인다. 웹툰을 원작으로 한 드라마와 영화 등이 활발히 제작됨에 따라  영상 콘텐츠를 먼저 접하고 나서 웹툰을 찾아보는 현지 팬들도 증가하고 있다.
한류전문 정보포털 Lollipop Argentina는 ‘새로운 한류의 주역’으로서 웹툰을 소개한 바 있는데  현지에 소개된 웹툰 대부분은 한국문화원의 홍보 활동과 연관이 깊다. 2016년 7월에는 ‘한국 만화의 기원과 진화’를 주제로 웹툰에 대한 정보를 공유하는 장을 마련하였다. 연사로는 아르헨티나 디지털 문화콘텐츠 전문 포털 ‘코미케안도(Comiqueando)’ 소속 기자 막시밀리아노 브리토스가 맡았으며  그는 “네이버와 다음 등 한국 내 주요 포털 사이트를 중심으로 한 ‘열린플랫폼에서 웹툰을 제공하며 접근성을 높이고 있다”면서 “한국의 웹툰 문화는 단지 만화라는 콘텐츠를 종이책에서 인터넷이라는 매체로 옮긴 것만을 의미하지 않는다. 공포물에는 으스스한 사운드를 삽입(揷入)하여 극적 효과를 높이는 등 새로운 장르를 개척하고 있다”고 호평하였다. 또한 막시밀리아노는 “최근 한국웹툰의 해외 서비스가 확대되면서  영어 일본어 중국어 등으로 현재 서비스 되고 있다. 스페인어로도 번역되어 서비스 된다면  아르헨티나에서도 ‘한류’ 물결을 타고 한국 만화에 대한 인기가 더욱 증가할 것”이라고 전망하기도 했다.
한국문화원은 K-씨네  K-드라마  K-Pop 등 대표적인 한류 콘텐츠만이 아니라 아직 잘 소개되지 않은 E-콘텐츠 분야도 홍보하려는 시도를 확대하고 있으며  이를 계기로 새로운 분야에서 한류 열풍이 점화(點火)되고  산업적인 효과가 창출되는 환경을 도모하고자 노력하고 있다.",2019.0
310,Argentina,AR,아르헨티나,한국 전통문화,"현지에서 자발적으로 홍보되고 있는 한국 전통 문화는 크게 한복  아리랑  사물놀이로 나눌 수 있다. 한복은 그 화려함과 우아함으로 한국관련 행사시 한복기념촬영 등을 통해 현지인들에게 지속적으로 인지도를 얻고 있다.
한인동포들로 구성된 사물놀이패로 6인조  8인조  15인조로 전문가 급의 공연을 보여주는 누리패가 각종 문화행사에서 활발히 활동하고 있으며 현지인으로는 아리랑 및 한국동요를 연주하는 남성 기타 4인조 인 크레센도(Increscendo)  지방도시 투쿠만에서는 한인회장이 지원하고 현지 여성들 20여명으로 구성된 부채춤 공연단이 관련 행사에 출연하여 양국 문화교류에 기여하고 있다. 또한 최남단의 티에라 델 푸에고 주 우수아이아의 이민자의 날 행사에서도 한국문화가 소개되는 등 한국문화가 넓게 퍼져나가고 있다.
아르헨티나 한국 문화원은 상대적으로 덜 알려진 한국전통문화상을 알리기 위해 2019년 9월 26일(목)에 국립민속박물관과 함께 한국문화상자 전시를 개최한 바 있다. 또한 한국문화에 관심이 있는 아르헨티나 시민들을 대상으로 조각보  서예 등의 강좌를 개설하여 한국의 다양한 전통문화를 알리고 있다",2019.0
311,Argentina,AR,아르헨티나,"공연, 미술","아르헨티나 내 가장 인기 있는 공연예술 장르는 클래식 음악이다. 이에 따라 한국문화원은 K-클래식을 중점 소개 장르 중 하나로 선정하여 한국의 대표 아티스트들을 아르헨티나에 꾸준히 소개해 왔다. 2012년 한-아 수교 50주년 기념으로 세계 3대 오페라 극장 중 하나인 콜론극장에서 소프라노 조수미 공연으로아르헨티나에 K-클래식의 위상을 드러낸 바  그 열기를 이어 2013년에 김선욱 2014년에 손민수가 각각 피아노 독주회를 콜론 극장에서 개최하였다. 특히  라나시온은 ‘콜론극장에서 숨겨진 비밀이 베일을 벗다’라는 제목으로 비중 있게 다루며 한국인의 클래식 수준을 높이 평가했다.
2015년에는 지휘자 김대진이 부에노스아이레스 필하모닉 오케스트라와 협연  지휘자 안주용이 국회 오케스트라와 협연  피아니스트 문지영  김명현  박재홍 3인이 ‘라이징 영 피아티스트 시리즈-3인 3색’ 페스티벌을 진행하였다.
2017년에는 키르치네르 문화센터 1 800석 규모의 신포니아 홀에 만석을 이루어 세계적인 피아니스트 임동혁의 초청연주회를 성공적으로 개최  한국의 클래식 위상을 다시 한 번 증명하였다. 2018년에는 바이올리니스트 김계희가 문화원 이전개념행사의 일환으로 키르츠네르 문화센터 명예의 홀에서 독주회를 개최하였고  2019년은 피아니스트 손열음(콜론극장)  피아니스트 이효주(제5회 코넥스 클래식음악페스티벌 참가)  소프라노 박혜상(키르츠네르문화센터)이 주요 문화예술기관에서 독주회를 성공적으로 개최하였다.
커지고 있는 한류의 영향이 돋보이는 장르는 전통음악  현대무용과 연극 분야이다. 문화원은 ‘한국의 소리’ 제하 퓨전 국악 그룹 ‘미지’  창작국악단 ‘도드리’등 한국의 전통음악 및 월드뮤직 그룹을 지속적으로 소개해 왔으며 현지 극장 및 축제조직위와의 협력으로 김복희 무용단과 현대무용앙상블 모던테이블 등 현대무용 팀의 공연을 주선해왔다. 특히 2014년 부에노스아이레스 현대무용제에서 개막작으로 선보인 모던테이블의 ‘시나위+다크니스 품바’ 공연의 김재덕 안무가는 아르헨티나 국립현대무용단의 초청으로 해당 무용단의 대표 레퍼토리가 된 ‘공간적 장력’ 공연을 창작하기도 했다. 또한 계속적으로 한국의 전통음악을 알리기 위한 시도로 사물놀이 그룹 ‘유희노리’ 및 앙상블 ‘시나위’ 등의 새로운 경향의 국악 연주자가 매년 초청되어 국악의 위상을 높이는 작업을 지속적으로 하고 있다. 특히 2019년 ‘가야금앙상블 ‘셋’은 아르헨티나 제1의 문화센터인 키르츠네르 문화센터에서 처음으로 국악을 성공적으로 소개하였으며  국악그룹‘타고’는 2019년 메르코수르 국제연극제 폐막공연 성공개최에 주재국 내 한국전통음악의 가능성을 보여준 좋은 예가 되었다.
연극 분야에서는 극단 초인의 ‘특급호텔’과 체험예술공간 꽃밭의 아동극 ‘종이창문’  극단 로･기･나래의 인형극 ‘선녀와 나무꾼’  극단 하땅세의 ‘파우스트Ⅰ+Ⅱ’ 외 아동극 ‘붓바람’ 등이 현지 주요 공연예술제 및 극장에 초청되어 투어를 진행한 바 있다.
미술 분야에서는 도예  회화  조각 등의 분야에서 활동하는 재아 한인 아티스트들의 전시회와 국립장식박물관과의 협력으로 진행된 신승원 서예전  레콜레타문화센터와 진행한 단색화 ‘텅 빈 충만’ 전  포르타밧 미술관에서 진행한 미디어아트전을 선보였다. 또한 주재국 내 행위예술관련 문화행사인 Bienal Performance에 초청된 정금형 작가의 <심폐소생술 연습>과 장영혜중공업의 <삼성과 나 : 하나의 사랑의 역사>  베니스 비엔날레 은사자상 수상자 임흥순 작가와 우고 아베타의 한-아 교류전<다른 나라에서>와 영상매개 프로젝트 <우리를 연결하는 법>같이 해외에서 인정받은 작가의 작품이 아르헨티나에 소개되고 교류 프로그램으로 현지에서 진행되어 한국예술가의 우수한 면모를 보여주었다.
특히나 문화원은 원내 특별전시를 통해 만화  팝아트  조각보  사진  포스터  연  부채 등 한국 또는 한국과 아르헨티나 문화교류차원의 다양한 장르의 전시를 기획  실행하였다.
특히 사진분야에서는 현지에서 개최되는 국제규모의 사진비엔날레 ‘빛의축제’에 지속적으로 한국작가들이 참여하므로써  한국사진의 우수성을 알리는 계기를 마련하였다. 2018년 본 비엔날레를 통해 소개된 이대성 <미래의 고고학>을 2019년에는 미시오네스 주 포사다  부에노스 아이레스 주 탄딜에서 순회사진전 및 한국사진작가 관련 대중강연을 지역 문화기관 및 사진관련 현지단체와 공동 개최함으로써 문화교류 증진에 기여하였다.
그간 서양의 문화로 자리매김한 음악  발레에서 최근 세계 유명 콩쿠르에서 한국인이 대거 수상하면서 위상이 높아지고 있다. <2011년 우수아이아 국제 음악 축제>에 첼리스트 우지연 교수가 참석한 계기에 우수아이아 일간지가 한국 클래식 음악가의 위대함을 대서특필했다. 또한 2010년 <제1회 부에노스아이레스 국제바이올린콩쿠르>에서 바이올리니스트 조진주씨가 1위를 수상하면서 한국인의 클래식 수준을 알리는 계기가 되었고  아르헨티나 최대 일간지 라 나시온(La Nación)  클라린(Clarin) 등은 한국 클래식 음악가의 우수성을 보도했다.",2019.0
312,Argentina,AR,아르헨티나,만화,"아르헨티나 만화시장은 1950년~60년대 자국 만화 위주로 형성되었으며 1990년 미국 코믹스가 수입되어  큰 인기를 끌다가 1997년부터는 브라질과 마찬가지로 일본 망가가 유행하고 있다. 주요 민영방송사 및 아동전문채널에서 일본만화가 대대적으로 방영되었으며  이에 일본만화에 대한 대중적 인지도가 크게 자리 잡고 있으며  미국  프랑스 등 만화도 많이 소비되고 있다. 또한 시사만화인 <마팔다(Mafalda)>가 1964년 Primera Plana라는 아르헨티나 주간지에 실려 지난 40년 동안 지속적인 인기를 누리고 있다. 하지만 한국 만화의 경우  아르헨티나에 잘 소개되지 않았고 아직 대중적으로 알려지지 않은 단계에 있다. 스페인어 번역본을 시중에서 구하기가 어려울 뿐더러  번역 작업도 거의 전무해 한국 만화 소개가 잘 이루어지지 않고 있다. 또한 현지 만화 관련 출판사에서도 재정적인 이유 때문에 흥행이 보장된 미국의 히어로물 등을 출판하는 것을 선호하는 추세였다. 그럼에도 불구하고 한국 만화에 대한 마니아층도 분명히 존재하여 만화책의 경우 스페인어로 번역되어 마니아들을 중심으로 <프리스트(형민우)>가 큰 인기를 얻은 바 있다. 
아르헨티나는 중남미 국가 중 제 1의 도서수출국으로  출판시장이 크나 만화시장은 외국계 기업의 점유율이 75% 이상으로 높은 편이다. 하지만 아르헨티나는 2010년 이후 자국의 만화산업이 양적  질적으로 성장하고 있으며  2010년 기준 아르헨티나 자국 작가에 의해 총 83종의 만화책 및 만화잡지 약 10여 종 이상이 발행되기도 하였다. 아직은 디지털 만화시장 규모보다는 인쇄만화 시장이 주를 이루고 있지만 모바일 미디어와 인터넷의 성장으로 최근 스마트폰을 이용해 구독하는 앱 만화도 증가하였는데  대표적으로 한국의 레진코믹스(LezhinComics)  일본 코미코(Comico) 등이 상위권에 랭크되어 많은 다운로드 수를 기록하기도 했다. 또한 ‘코리아 브랜드 한류상품박람회(KBEE)’에서 국내 애니메이션 제작사 그래피직스는 아르헨티나 콘텐츠 유통사 아스트로랩(Astrolab)  아르헨티나 국영방송사 테크노폴리스 TV와 애니메이션 프로젝트 MOU를 체결하기도 했다. 
아르헨티나는 수입 만화의 비중이 높은 편으로  수입 만화에 대한 다양한 출판사들의 관심이 증대되고 있다. 아르헨티나는 세계 만화 전시회 등 국제적 만화 행사를 주최하는 등  만화산업의 활성화를 도모하고 있으며  정부의 지원도 적극적인 편이다. 그 예로 세계 5대 도서전시회 중 하나인 ‘부에노스아이레스 도서전’(매년 4-5월)  ‘비녜타스 수엘타스(Vinetas sueltas)’ 출제  라스팔마스에서 지방 만화산업 활성화를 위해 개최되는 국제 만화축제 ‘Crack Bang Boom’ 등 만화 관련 행사들이 활성화 되어있다. 아르헨티나 정부는 프랑크푸르트 국제도서전을 지원하기도 하고  엑토르 헤르만 오에스테렐드(HéctorGermán Oesterheld)의 전설적인 국민만화 <El Eternauta>를 기념 하고 만화의 가치성을 제고하기 위해 매년 9월 4일을 ‘만화의 날’로 지정하기도 했다. 이처럼 아르헨티나의 만화는 정부의 적극적 협조 하에 국제 만화 행사를 개최하는등  만화 산업 활성화를 위한 노력을 하고 있다. 
한국문화원 역시 한국만화를 보다 적극적으로 현지에 소개하기 위한 프로그램을 발굴 중이다. 2014년 4월 아르헨티나 최대 문화 플랫폼인 “제 40회 부에노스아이레스 국제 도서전(Feria Internacional del Libro de BuenosAires)” 에서 한국 문화원은 신 한류 콘텐츠인 애니메이션  만화  웹툰을 주요 아이템으로 하여 한국관을 운영  스페인어로 번역된 한국웹툰 <반야>와 <천추>등 많은 도서와 <라바>  <뿡뿡이>  <태권 V> 등 캐릭터 상품과 그래피 직스와 코안 스튜디오 등에서 제작한 정글 스페이스  <예~ 소년 어사 출두요> 등을 소개했다. 그리고 “제42회 국제도서전”을 통해 세계적으로 인정받은 우수한 한국 그림책을 소개한 바 있으며  국제도서전과 연계해 “한국의 그림책과 애니메이션  웹툰”에 대한 컨퍼런스도 개최한 바 있다. 또한 문화원에서 2016년 6월부터 7월까지 2달간 ‘한국의 만화展 - 로봇 만화 전시회’를 개최하여  최초로 아르헨티나 관객들에게 한국만화 속 대표적인 로봇 캐릭터를 소개하였으며  현지 만화관련 대중적 잡지 겸 포털 소속 기자가 “한국 만화의 기원과 진화”를 주제로 강연을 진행하기도 했다. 한국문화원은 이러한 노력으로 새로운 분야에서 한류 열풍이 점화되고 산업적인 효과가 창출될 수 있는 기반을 마련하고 있다. 
주아르헨티나 한국문화원은 문화콘텐츠 진흥원과 함께 2020년 하반기에 한국의 유명 캐릭터 및 애니메이션을 소개하는 전시를 추진하고자 계획 중이다.",2019.0
313,Argentina,AR,아르헨티나,한국어,"아르헨티나 내 한국어 학습 열풍은 K-Pop과 비례하여 수요가 늘어나는 경향을 보인다. 2006년 주아르헨티나 한국문화원 세종학당 개원 이래  매학기 약
150여 명의 한국어 학습자를 양산하고 있다. 한류 열풍의 영향으로 최근 몇 년전부터 수강 신청에 모집정원 인원보다 10배 정도가 몰리며 한국어 학습 열기를 반증하고 있다. 또한 한국어 강좌에 대한 문의도 상당하다.
한국어 학습 수요가 늘어남에 따라  사립 및 공립 교육기관에서도 한국어 강좌가 확대되고 수도 부에노스아이레스뿐만 아니라 멘도사  투쿠만 등 다수 지방에서도 한국어 강좌를 운영하고 있다.
부에노스아이레스에 소재한 대표적인 언어 센터 CUI(대학언어센터 Centro Universitario de Idiomas)의 경우  2017년에는 개설된 한국어 강좌가 총 7개반 이었던 반면  현재는 20개반이 운영되고 있는 것으로 보아 수요가 꾸준히 증가하고 있는 것으로 보인다.
아르헨티나 유력 주간지 페르필은 “한국 드라마와 K-Pop  한글에 대한 관심높여 - 한국어 강좌 3년 만에 강좌 수 2배로 증가”(2016.5.22.자) 특집 기사를 통해  “한국의 유명 음악 장르인 K-Pop을 위시한 한류가 올해 공중파 TV를 장악함에 따라  한국어를 배우려는 사람들이 늘어나고 있다”고 보도했다. <시크릿 가든>  <천국의 계단>  <별에서 온 그대>  <엔젤 아이즈> 등 한국드라마 4편이 대중적인 영향력이 막대한 TV 매체를 통해 방영되면서  한국어 학습에 관심을 갖는 연령층이 다양해진 것도 최근에 두드러지는 현상이다. K-드라마 방영 이전에 한국어 강좌에는 주로 젊은 여성층의 수요가 현저히 높았던 반면  최근에는 중장년층의 관심도가 높아지고 더불어 남성들의 학습 수요도 확대되고 있다.
2006년 개원한 주아르헨티나 한국문화원은 세종학당 운영 이래  매학기 약 150여 명의 한국어 학습자를 양산하고 있다. 한류 열풍의 영향으로 최근 3년 전 부터 수강 신청에 모집정원 인원보다 10배 정도가 몰려 한국어 학습 열기를 방증하고 있으며  한국어 학습 수요가 늘어남에 따라  수도 부에노스아이레스뿐만 아니라 멘도사  투쿠만  라플라타  꼬르도바 지방의 사립 및 공립기관에서도 한국어 강좌를 개설하여 운영하고 있다. 부에노스아이레스에 소재한 대표적인 언어 센터 CUI(대학언어센터 Centro Universitario de Idiomas)  플로레스 대학 외에 2017년도에는 아르헨티나 명문 부에노스아이레스 국립대학교 산하 언어 센터(Laboratorio de idiomas UBA)에서도 한국어 강좌가 개설되었다.
또한 한인 교민들을 대상으로 한국학교에서 운영하는 토요 한글학교는 한국어를 배우고자 하는 현지인들의 많은 문의 및 요청으로 14개반 중 4개반을 현지인 대상으로 운영을 하고 있다.
한국문화원은 한국어 학습에 대한 뜨거운 관심에 부응해 2015년 “제1회 한국어 말하기 대회”를 개최 후 매년 ‘한국어 말하기 대회’를 개최하여 우승자에게 세종학당 우수학습자 방한 프로그램 참여기회를 제공하고 있다. 2016년에는<더욱 가까운 한국 - 한국어로 요령 있게 말하는 법> 등의 특강을 진행하였다. 2019년에는 한글날기념 ‘한글 표어 예쁘게 쓰기’ 대회 등을 개최하여 한글에 대한 관심을 높여가고 있다. 앞으로도 한국어 학습자의 흥미를 제고하고  적극적인 참여를 유도할 수 있는 프로그램과 한국어 강좌 운영을 확대할 예정이다.",2019.0
